{
  "schema_version": 1,
  "protocol_id": "p14-strained-aromatic-pi-distortivity/0.1",
  "proposition_id": "P14",
  "proposition": "strained-aromatic bond-length distortion requires an independently identifiable pi-distortivity contribution beyond angle strain alone",
  "classification": "consistent",
  "classification_zh": "与原著一致",
  "decision_summary_zh": "固定几何端点、算符实现和生产级五参数优化均通过预注册门禁；P14在冻结的C12H6最小体系和PLG操作定义下与原著一致。",
  "optimization_evidence_stage": "five_parameter_D3h_B3LYPG_6_31Gd_production",
  "optimization_evidence_label_zh": "B3LYPG/6-31G(d)五参数生产优化",
  "scope": "benzotricyclobutadiene_10_12_C12H6_frozen_source_proxy_protocol",
  "source_calculation_git_commit": "d55e12c9ee9e4d8a201405be75a1c6c7e19e0d7f",
  "runtime_provenance": {
    "platform": "WSL_2_Ubuntu_24_04",
    "python_version": "3.12.13",
    "pyscf_version": "2.14.0",
    "numpy_version": "2.5.1",
    "status": "project_environment_snapshot_not_embedded_in_original_per_job_record"
  },
  "quantitative_evidence": {
    "source_G_delta_r_angstrom": 0.177,
    "source_PLG_delta_r_angstrom": -0.002,
    "source_d_delta_r_GP_angstrom": 0.179,
    "optimization_G_delta_r_angstrom": 0.1772402858338631,
    "optimization_PLG_delta_r_angstrom": 0.00503665056969016,
    "optimization_d_delta_r_GP_angstrom": 0.17220363526417293,
    "optimization_d_delta_r_residual_angstrom": -0.006796364735827065,
    "optimization_endpoint_kcal_mol": 67.67971905703143,
    "optimization_endpoint_residual_kcal_mol": 0.5997190570314359,
    "source_level_endpoint_kcal_mol": 67.08689934831932,
    "source_endpoint_kcal_mol": 67.08,
    "source_level_endpoint_residual_kcal_mol": 0.006899348319322485,
    "memory_implementation_energy_difference_hartree": 2.2737367544323206e-13
  },
  "decision_checks": {
    "fixed_geometry_operator_smoke_passed": true,
    "five_parameter_optimization_record_passed_its_gate": true,
    "five_parameter_production_optimization_qualified": true,
    "memory_controlled_operator_equivalent": true,
    "source_level_fixed_geometry_anchor_passed": true,
    "source_PLG_near_equal_bonds": true,
    "optimization_reduces_bond_alternation": true,
    "optimization_response_same_direction": true,
    "optimization_d_delta_within_bond_tolerance": true,
    "optimization_endpoint_same_sign": true,
    "optimization_endpoint_within_energy_tolerance": true,
    "source_level_endpoint_same_sign": true,
    "source_level_endpoint_within_energy_tolerance": true
  },
  "optimization_eligibility_checks": {
    "optimization_scientific_classification_allowed": true,
    "optimization_protocol_id_matches": true,
    "optimization_protocol_authorized": true,
    "optimization_stage_is_production": true,
    "optimization_method_matches": true,
    "optimization_basis_matches": true,
    "optimization_grid_matches": true,
    "G_optimizer_success": true,
    "G_gradient_within_tolerance": true,
    "G_termination_qualified": true,
    "G_no_active_bound": true,
    "G_state_converged": true,
    "G_78_electrons": true,
    "PLG_optimizer_success": true,
    "PLG_gradient_within_tolerance": true,
    "PLG_termination_qualified": true,
    "PLG_no_active_bound": true,
    "PLG_state_converged": true,
    "PLG_78_electrons": true
  },
  "decision_verdict": "PASS",
  "evidence_files": [
    "evidence/P01-P14/P14/processed/p14_benzotricyclobutadiene_fixed_geometry_smoke_v0.1.json",
    "evidence/P01-P14/P14/processed/p14_C12H6_B3LYPG_6_31Gd_production_optimization_v0.1.json",
    "evidence/P01-P14/P14/processed/p14_memory_controlled_eri_equivalence_v0.1.json",
    "evidence/P01-P14/P14/processed/p14_C12H6_source_level_fixed_geometry_v0.1.json"
  ],
  "evidence_sha256": {
    "evidence/P01-P14/P14/processed/p14_benzotricyclobutadiene_fixed_geometry_smoke_v0.1.json": "ce98a4d3e4a297a7edfa14de636757dbd7ea98c36bb66de65d01a241034b3803",
    "evidence/P01-P14/P14/processed/p14_C12H6_B3LYPG_6_31Gd_production_optimization_v0.1.json": "761a30fe0960557860e643e84e70fc677bd90f912527ae33c25396096a540b9a",
    "evidence/P01-P14/P14/processed/p14_memory_controlled_eri_equivalence_v0.1.json": "7b52849e48c7b451b9e2cb689c099c73684f2cf354ebed2b8a2b8685bb8f81bf",
    "evidence/P01-P14/P14/processed/p14_C12H6_source_level_fixed_geometry_v0.1.json": "c515423789a2f813693d3845db1e97c463c6c8552d2dcef185227ca507d953ba"
  },
  "input_files": {
    "source_proxy_G": "evidence/P01-P14/P14/inputs/source_proxy_G.xyz",
    "source_proxy_PLG": "evidence/P01-P14/P14/inputs/source_proxy_PLG.xyz"
  },
  "input_sha256": {
    "source_proxy_G": "fa2b0a1c88d467bd51fec6e140a07a65f74a64ad7e63fbf550d611b3b60c571c",
    "source_proxy_PLG": "0fd8593ebdf93b59642abbb8b9a84336e30de74d5fc3f4a8721cb2412d3fbcc7"
  },
  "geometry_sha256": {
    "source_proxy_G_atoms": "31dbd8afea9fcfefe59330fd937fc62aa19e6b03b6c94f24c8360d3032a17d19",
    "source_proxy_PLG_atoms": "698ace9f58f7c11134c5faab80039bbcfacf9b5755c57ff329c9e063e8122f19",
    "optimized_G_atoms": "798a60f6299d53e87feee9dd1882c03396fb7ecfd5b1a1e642530c6c9fb7e028",
    "optimized_PLG_atoms": "88feb133106b49b4d8ee05c633c834ea1752de8503516bdd24c83b7da835d20e"
  },
  "limitations": [
    "source_full_Cartesian_coordinates_not_public",
    "CH_distance_fixed_at_1.080_angstrom_proxy",
    "production_optimization_limited_to_five_parameter_planar_D3h_subspace",
    "no_full_Cartesian_frequency_or_wider_symmetry_optimization_claimed",
    "STO3G_technical_pilot_is_not_scientific_classification_evidence",
    "single_C12H6_system_does_not_establish_universal_19_molecule_law"
  ],
  "scientific_label": "consistent",
  "publishable_scientific_classification": true,
  "production_label": false,
  "training_eligible": false
}
